id;name;description;vendor;price;currency;category;images
1;"Escuminac Extra Rare Maple Syrup";"Our earliest syrup from the season";"Escuminac";25.95;"USD";"Food & beverages";"1,2"
2;"Escuminac Maple Butter";"A great sweet snack made from pure maple syrup";"Escuminac";9.95;"USD";"Food & beverages";"3,4"
3;"Escuminac maple syrup gift pack";"A great gift to give to family and friends";"Escuminac";49.95;"USD";"Food & beverages";"5,6"
4;"He-Man action figure";"The legendary hero from Masters of the Universe";"Mattel";14.95;"USD";"Toys";"7"
5;"Masters of the Universe Castle Grayskull";"He-Man's fort and base";"Mattel";59.95;"USD";"Toys";"8,9"
6;"55 inch widescreen television";"A great and detailed wide resolution screen for all your needs";"Samsung";1495.00;"USD";"Computers & Electronics";"10,11"
7;"Macbook Pro 13 inch";"A great workstation for all of your computing needs";"Apple";2995.00;"USD";"Computers & Electronics";"12,13"

